id,title,content,text,url,published,source,source_category,publisher,collected_at
8e1e08fd99f73c65,Cognitive Threat Intelligence and Explainable Federated Security Analytics for distributed Infrastructure Systems,"The increasing adoption of distributed infrastructure systems, cloud computing, Internet of Things (IoT) technologies, and edge-based architectures has significantly expanded the cybersecurity attack surface and introduced increasingly sophisticated cyber threats. Conventional centralized intrusion detection approaches often face challenges related to scalability, data privacy, communication overhead, and limited transparency in artificial intelligence-driven decision-making processes. To address these limitations, this study proposes a Cognitive Threat Intelligence and Explainable Federated Security Analytics framework for distributed infrastructure systems. The proposed framework integrates Federated Learning (FL), Explainable Artificial Intelligence (XAI), and cognitive cybersecurity analytics to enable collaborative and privacy-preserving cyber threat detection across distributed network environments. Instead of transmitting sensitive raw network traffic data to centralized servers, local security models are independently trained at distributed nodes, where only encrypted model parameters and updates are shared through a federated aggregation mechanism. This decentralized learning architecture improves privacy protection while reducing communication dependency and centralized security risks. To enhance intelligent threat analysis, the framework incorporates machine learning and deep learning algorithms including Random Forest, XGBoost, Autoencoder","Cognitive Threat Intelligence and Explainable Federated Security Analytics for distributed Infrastructure Systems. The increasing adoption of distributed infrastructure systems, cloud computing, Internet of Things (IoT) technologies, and edge-based architectures has significantly expanded the cybersecurity attack surface and introduced increasingly sophisticated cyber threats. Conventional centralized intrusion detection approaches often face challenges related to scalability, data privacy, communication overhead, and limited transparency in artificial intelligence-driven decision-making processes. To address these limitations, this study proposes a Cognitive Threat Intelligence and Explainable Federated Security Analytics framework for distributed infrastructure systems. The proposed framework integrates Federated Learning (FL), Explainable Artificial Intelligence (XAI), and cognitive cybersecurity analytics to enable collaborative and privacy-preserving cyber threat detection across distributed network environments. Instead of transmitting sensitive raw network traffic data to centralized servers, local security models are independently trained at distributed nodes, where only encrypted model parameters and updates are shared through a federated aggregation mechanism. This decentralized learning architecture improves privacy protection while reducing communication dependency and centralized security risks. To enhance intelligent threat analysis, the framework incorporates machine learning and deep learning algorithms including Random Forest, XGBoost, Autoencoder",https://arxiv.org/abs/2606.05701v1,2026-06-04T04:41:53Z,arXiv - Enterprise AI Research,research,,2026-06-30T08:12:48+00:00
2707d4dd7de011da,StableRCA: Robust Graph-Agnostic Mechanism-Level Root Cause Analysis,"Root-Cause Analysis (RCA) seeks to identify the variables responsible for abnormal system behavior in complex domains such as manufacturing, cloud computing, and healthcare. Existing approaches face a critical bottleneck: graph-based causal methods can identify intervention targets but typically require a known or accurately estimated causal graph, while graph-free statistical methods either localize marginal anomalies rather than structural causes, or rely on restrictive assumptions about graph structure or functional form. We propose StableRCA, a local mechanism-level RCA framework that avoids global graph discovery by estimating local Markov boundaries and detecting conditional distribution shifts within them. Leveraging the Independent Causal Mechanism principle, we show that intervention targets can be identified with probability converging exponentially in sample size under faithful Markov boundary recovery and non-degenerate mechanism shifts. Experiments on synthetic benchmarks and five real-world datasets demonstrate that StableRCA is robust to graph misspecification, effective under multiple intervention targets, scalable to large systems, and reliable across diverse application domains. Code is available at: https://anonymous.4open.science/r/StableRCA-E362","StableRCA: Robust Graph-Agnostic Mechanism-Level Root Cause Analysis. Root-Cause Analysis (RCA) seeks to identify the variables responsible for abnormal system behavior in complex domains such as manufacturing, cloud computing, and healthcare. Existing approaches face a critical bottleneck: graph-based causal methods can identify intervention targets but typically require a known or accurately estimated causal graph, while graph-free statistical methods either localize marginal anomalies rather than structural causes, or rely on restrictive assumptions about graph structure or functional form. We propose StableRCA, a local mechanism-level RCA framework that avoids global graph discovery by estimating local Markov boundaries and detecting conditional distribution shifts within them. Leveraging the Independent Causal Mechanism principle, we show that intervention targets can be identified with probability converging exponentially in sample size under faithful Markov boundary recovery and non-degenerate mechanism shifts. Experiments on synthetic benchmarks and five real-world datasets demonstrate that StableRCA is robust to graph misspecification, effective under multiple intervention targets, scalable to large systems, and reliable across diverse application domains. Code is available at: https://anonymous.4open.science/r/StableRCA-E362",https://arxiv.org/abs/2606.05636v1,2026-06-04T03:02:23Z,arXiv - Enterprise AI Research,research,,2026-06-30T08:12:48+00:00
b8b536425b0f7d3a,An ERP Study on Recursive Locative Processing in Mandarin-Speaking Children with Autism,"Recursion enables the generation of hierarchical linguistic structures but imposes substantial processing demands during real-time comprehension. While difficulties with complex syntax have been reported in autism spectrum disorder (ASD), the temporal dynamics of recursive processing remain poorly understood. This study used event-related potentials (ERPs) to examine how Mandarin-speaking children with ASD process two-level recursive locative constructions. Twenty-four children (12 ASD, 12 typically developing, TD) participated in a cross-modal sentence-picture matching task. Neural responses were analyzed across three processing stages associated with structural prediction (P200), semantic integration (N400), and syntactic reanalysis (P600), with mental age controlled. Results revealed a systematic divergence between groups. TD children showed clear P200 and P600 modulation in response to structural mismatch, whereas ASD children exhibited attenuated early differentiation and reduced late reanalysis effects. In contrast, ASD children showed enhanced N400 responses under mismatch conditions, indicating increased semantic integration demands. In addition, the ASD group displayed significantly greater inter-individual variability in hemispheric lateralization, although lateralization strength was not associated with receptive vocabulary performance. These findings support a cascading account in which reduced early predictive engagement in ASD leads to increased integration costs and diminished reanalysis efficiency during recursive processing. More broadly, the results highlight the importance of both temporal processing dynamics and neural variability in understanding language differences in ASD.","An ERP Study on Recursive Locative Processing in Mandarin-Speaking Children with Autism. Recursion enables the generation of hierarchical linguistic structures but imposes substantial processing demands during real-time comprehension. While difficulties with complex syntax have been reported in autism spectrum disorder (ASD), the temporal dynamics of recursive processing remain poorly understood. This study used event-related potentials (ERPs) to examine how Mandarin-speaking children with ASD process two-level recursive locative constructions. Twenty-four children (12 ASD, 12 typically developing, TD) participated in a cross-modal sentence-picture matching task. Neural responses were analyzed across three processing stages associated with structural prediction (P200), semantic integration (N400), and syntactic reanalysis (P600), with mental age controlled. Results revealed a systematic divergence between groups. TD children showed clear P200 and P600 modulation in response to structural mismatch, whereas ASD children exhibited attenuated early differentiation and reduced late reanalysis effects. In contrast, ASD children showed enhanced N400 responses under mismatch conditions, indicating increased semantic integration demands. In addition, the ASD group displayed significantly greater inter-individual variability in hemispheric lateralization, although lateralization strength was not associated with receptive vocabulary performance. These findings support a cascading account in which reduced early predictive engagement in ASD leads to increased integration costs and diminished reanalysis efficiency during recursive processing. More broadly, the results highlight the importance of both temporal processing dynamics and neural variability in understanding language differences in ASD.",https://arxiv.org/abs/2606.05620v1,2026-06-04T02:45:13Z,arXiv - Enterprise AI Research,research,,2026-06-30T08:12:48+00:00
8270bf1b7d2b6a68,SWE-InfraBench: Evaluating Language Models on Cloud Infrastructure Code,"Building infrastructure-as-code (IaC) in cloud computing is a critical task, underpinning the reliability, scalability, and security of modern software systems. Despite the remarkable progress of large language models (LLMs) in software engineering -- demonstrated across many dedicated benchmarks -- their capabilities in developing IaC remain underexplored. Unlike existing IaC benchmarks that predominantly center on declarative paradigms such as Terraform and involve generating entire codebases from scratch, our benchmark reflects the incremental code edits common in enterprise development with imperative tools like the AWS CDK. We present SWE-InfraBench, a diverse evaluation dataset sourced from dozens of real-world IaC codebases that challenge LLMs to perform realistic code modifications in AWS CDK repositories. Each example requires models to implement changes to existing codebases based on natural language instructions, with success determined by passing provided test cases. These tasks demand sophisticated reasoning about cloud resource dependencies and implementation patterns beyond conventional code generation challenges. Our evaluation results reveal significant limitations in current LLMs showing that even state-of-the-art systems struggle with many tasks -- the best model, Sonnet 3.7, succeeds in only 34\% of cases, while specialized reasoning models like DeepSeek R1 achieve just 24% success. The SWE-InfraBench dataset is available at: https://www.kaggle.com/datasets/64e59070fd51c0278560b01eb5dc4f3c447d5268cdabe5a350d2969e4413fea5","SWE-InfraBench: Evaluating Language Models on Cloud Infrastructure Code. Building infrastructure-as-code (IaC) in cloud computing is a critical task, underpinning the reliability, scalability, and security of modern software systems. Despite the remarkable progress of large language models (LLMs) in software engineering -- demonstrated across many dedicated benchmarks -- their capabilities in developing IaC remain underexplored. Unlike existing IaC benchmarks that predominantly center on declarative paradigms such as Terraform and involve generating entire codebases from scratch, our benchmark reflects the incremental code edits common in enterprise development with imperative tools like the AWS CDK. We present SWE-InfraBench, a diverse evaluation dataset sourced from dozens of real-world IaC codebases that challenge LLMs to perform realistic code modifications in AWS CDK repositories. Each example requires models to implement changes to existing codebases based on natural language instructions, with success determined by passing provided test cases. These tasks demand sophisticated reasoning about cloud resource dependencies and implementation patterns beyond conventional code generation challenges. Our evaluation results reveal significant limitations in current LLMs showing that even state-of-the-art systems struggle with many tasks -- the best model, Sonnet 3.7, succeeds in only 34\% of cases, while specialized reasoning models like DeepSeek R1 achieve just 24% success. The SWE-InfraBench dataset is available at: https://www.kaggle.com/datasets/64e59070fd51c0278560b01eb5dc4f3c447d5268cdabe5a350d2969e4413fea5",https://arxiv.org/abs/2606.05249v1,2026-06-03T12:48:53Z,arXiv - Enterprise AI Research,research,,2026-06-30T08:12:48+00:00
fb9a724330b081fb,Predicting Lakehouse Performance in Clouds: An Empirical Exploration of Query Runtime Variance,"Data analytics increasingly runs on distributed lakehouse systems, where platform operators must optimise monetary, resource, and environmental costs. Query Performance Prediction (QPP) helps to balance these costs and supports workload management techniques, such as adaptive resource scaling and low-carbon scheduling. However, runtimes in lakehouses can vary substantially, and the impact of runtime variance on QPP accuracy and workload orchestration has not previously been systematically studied for lakehouse systems. This paper addresses this gap by investigating the runtime variance observed for distributed lakehouse analytical queries and its impact on QPP. First, we quantify the run-to-run variance using Kubernetes deployments across three public clouds and one private cloud, spanning multiple database scales and three analytical benchmarks. Our results demonstrate that repeated executions of the same query can vary in runtime by nearly twofold. Second, we conduct a factor analysis study assessing key sources of this runtime variance such as data locality, co-tenant load, and caching effects. Third, we examine how variance influences state-of-the-art QPP models, revealing that addressing key sources of variance can reduce prediction error up to 80%. Finally, we demonstrate the downstream implications for low-carbon scheduling as an example of a workload management technique that relies on performance prediction, showing that accounting for runtime variance can lead to a significant reduction in carbon costs.","Predicting Lakehouse Performance in Clouds: An Empirical Exploration of Query Runtime Variance. Data analytics increasingly runs on distributed lakehouse systems, where platform operators must optimise monetary, resource, and environmental costs. Query Performance Prediction (QPP) helps to balance these costs and supports workload management techniques, such as adaptive resource scaling and low-carbon scheduling. However, runtimes in lakehouses can vary substantially, and the impact of runtime variance on QPP accuracy and workload orchestration has not previously been systematically studied for lakehouse systems. This paper addresses this gap by investigating the runtime variance observed for distributed lakehouse analytical queries and its impact on QPP. First, we quantify the run-to-run variance using Kubernetes deployments across three public clouds and one private cloud, spanning multiple database scales and three analytical benchmarks. Our results demonstrate that repeated executions of the same query can vary in runtime by nearly twofold. Second, we conduct a factor analysis study assessing key sources of this runtime variance such as data locality, co-tenant load, and caching effects. Third, we examine how variance influences state-of-the-art QPP models, revealing that addressing key sources of variance can reduce prediction error up to 80%. Finally, we demonstrate the downstream implications for low-carbon scheduling as an example of a workload management technique that relies on performance prediction, showing that accounting for runtime variance can lead to a significant reduction in carbon costs.",https://arxiv.org/abs/2606.03464v1,2026-06-02T10:45:14Z,arXiv - Enterprise AI Research,research,,2026-06-30T08:12:48+00:00
ca8658d6982cf353,Analyzing the Evolution of Structural Communities within Microservice Architecture,"In recent years, the detection of anti-patterns in microservice architecture has gained traction, particularly to identify instances of Microservice Architectural Degradation. In such tasks, the microservice architecture is often modeled as a network of microservice dependencies. Recent works have explored how to assess the evolution of such architectural networks by considering the architecture of consecutive releases of the project. Particular anti-patterns related to the structure of the service network include Wrong cuts and Knot services. Community detection is a way to identify groups of services in a network that strongly depend on each other. If such groups cannot be mapped to business processes in the system, or if the same service belongs to multiple communities, this could indicate architectural degradation due to an inappropriate division of responsibilities or unoptimized communication. Temporal community detection methods have been proposed to analyze community structure that evolves in time. We performed temporal community detection within the microservice architecture of six releases of the train-ticket benchmark and analyzed the composition of the discovered communities and their activities over time. We observed a stable architecture with a clear separation of services into two communities, which we could identify with two business processes performed by the system. We found services belonging to several communities, as well as services within the same community with both incoming and outgoing connections. The membership strength metric provided by the leveraged algorithm enables fine-grained assessment of the microservice communities.","Analyzing the Evolution of Structural Communities within Microservice Architecture. In recent years, the detection of anti-patterns in microservice architecture has gained traction, particularly to identify instances of Microservice Architectural Degradation. In such tasks, the microservice architecture is often modeled as a network of microservice dependencies. Recent works have explored how to assess the evolution of such architectural networks by considering the architecture of consecutive releases of the project. Particular anti-patterns related to the structure of the service network include Wrong cuts and Knot services. Community detection is a way to identify groups of services in a network that strongly depend on each other. If such groups cannot be mapped to business processes in the system, or if the same service belongs to multiple communities, this could indicate architectural degradation due to an inappropriate division of responsibilities or unoptimized communication. Temporal community detection methods have been proposed to analyze community structure that evolves in time. We performed temporal community detection within the microservice architecture of six releases of the train-ticket benchmark and analyzed the composition of the discovered communities and their activities over time. We observed a stable architecture with a clear separation of services into two communities, which we could identify with two business processes performed by the system. We found services belonging to several communities, as well as services within the same community with both incoming and outgoing connections. The membership strength metric provided by the leveraged algorithm enables fine-grained assessment of the microservice communities.",https://arxiv.org/abs/2606.04047v1,2026-06-02T08:44:31Z,arXiv - Enterprise AI Research,research,,2026-06-30T08:12:48+00:00
353675144cca7097,Toward Pre-Deployment Assurance for Enterprise AI Agents: Ontology-Grounded Simulation and Trust Certification,"Pre-deployment verification of enterprise artificial intelligence (AI) agents remains a critical gap between large language model (LLM) capability benchmarking and production deployment. Post-deployment monitoring, human-in-the-loop controls, and prompt-level guardrails offer limited assurance once an agent is operating in production. We present an ontology-grounded verification framework -- to our knowledge the first to combine three components: an Agent Operational Envelope formalizing the certification space across permissions, domain constraints, safety properties, governance rules, and autonomy levels; an ontology-to-scenario generation pipeline that derives regulatory, operational, and adversarial test scenarios automatically; and a machine-verifiable Trust Certificate with graduated deployment verdicts. A controlled pilot across four regulated industries (Fintech, Banking, Insurance, Healthcare), instantiated as five industry-by-regulatory-regime cells across the United States and Vietnam (where Vietnam's 2025 AI Law makes such verification legally mandated for financial services), generated 1,800 scenarios evaluated against 125 primary-source regulatory requirements and 25 injected faults. Ontology-grounded generation significantly outperformed the dominant persona-based baseline on regulatory coverage (48.3% versus 33.1%; corrected p_c = .0006) and attained the highest domain specificity (4.77/5.0; p = 2e-6); transparently, its advantage over plain and retrieval-augmented prompting did not survive Bonferroni correction. Cross-validation across three LLM families (Claude Sonnet 4, Qwen 2.5 72B, Gemma 4 26B; 5,400 total scenarios) replicated the persona-versus-ontology pattern. The framework offers a reproducible, regulation-grounded route to pre-deployment assurance for enterprise AI agents, complementing runtime governance with an auditable deployment gate.","Toward Pre-Deployment Assurance for Enterprise AI Agents: Ontology-Grounded Simulation and Trust Certification. Pre-deployment verification of enterprise artificial intelligence (AI) agents remains a critical gap between large language model (LLM) capability benchmarking and production deployment. Post-deployment monitoring, human-in-the-loop controls, and prompt-level guardrails offer limited assurance once an agent is operating in production. We present an ontology-grounded verification framework -- to our knowledge the first to combine three components: an Agent Operational Envelope formalizing the certification space across permissions, domain constraints, safety properties, governance rules, and autonomy levels; an ontology-to-scenario generation pipeline that derives regulatory, operational, and adversarial test scenarios automatically; and a machine-verifiable Trust Certificate with graduated deployment verdicts. A controlled pilot across four regulated industries (Fintech, Banking, Insurance, Healthcare), instantiated as five industry-by-regulatory-regime cells across the United States and Vietnam (where Vietnam's 2025 AI Law makes such verification legally mandated for financial services), generated 1,800 scenarios evaluated against 125 primary-source regulatory requirements and 25 injected faults. Ontology-grounded generation significantly outperformed the dominant persona-based baseline on regulatory coverage (48.3% versus 33.1%; corrected p_c = .0006) and attained the highest domain specificity (4.77/5.0; p = 2e-6); transparently, its advantage over plain and retrieval-augmented prompting did not survive Bonferroni correction. Cross-validation across three LLM families (Claude Sonnet 4, Qwen 2.5 72B, Gemma 4 26B; 5,400 total scenarios) replicated the persona-versus-ontology pattern. The framework offers a reproducible, regulation-grounded route to pre-deployment assurance for enterprise AI agents, complementing runtime governance with an auditable deployment gate.",https://arxiv.org/abs/2606.04037v2,2026-06-02T02:37:11Z,arXiv - Enterprise AI Research,research,,2026-06-30T08:12:48+00:00
