id,title,content,text,url,published,source,source_category,publisher,collected_at
912d30ded07fc87f,D$^{2}$R$^{2}$OSR: Degradation-Disentangled Representation for Real-World Omnidirectional Image Super-Resolution,"With the growing demand for immersive visual experiences, high-quality omnidirectional images (ODIs) have become increasingly important. However, limitations in imaging devices and transmission bandwidth often lead to low-resolution ODIs, hindering the rendering of fine-grained 360° details, especially in the presence of real-world degradations and geometric distortions. Existing real-world super-resolution (Real-SR) methods are inadequate for ODIs, as their degradation models fail to account for the complex imaging pipeline involving fisheye capture and Equirectangular Projection (ERP), introducing severe aliasing and projection-specific distortions. To address these challenges, we propose D$^{2}$R$^{2}$OSR, a Degradation-Disentangled Representation framework for Real-world Omnidirectional image Super-Resolution. D$^{2}$R$^{2}$OSR explicitly models degradations arising from both fisheye imaging and ERP projection, guided by two key insights: (1) projection priors play a critical role in shaping real-world degradations, and (2) human perception in immersive environments is inherently viewpoint-centric. Accordingly, we introduce a Perspective Projection Representation (PPR) operating alongside the ERP branch to capture viewpoint-aware features, together with a Degradation-Specific Module (DSM) that jointly models ERP-induced geometric distortions and PPR-specific real-world degradations. Extensive experiments demonstrate that D$^{2}$R$^{2}$OSR achieves state-of-the-art performance and produces visually compelling, high-fidelity omnidirectional Real-SR results while maintaining favorable computational efficiency for low-resource deployment.","D$^{2}$R$^{2}$OSR: Degradation-Disentangled Representation for Real-World Omnidirectional Image Super-Resolution. With the growing demand for immersive visual experiences, high-quality omnidirectional images (ODIs) have become increasingly important. However, limitations in imaging devices and transmission bandwidth often lead to low-resolution ODIs, hindering the rendering of fine-grained 360° details, especially in the presence of real-world degradations and geometric distortions. Existing real-world super-resolution (Real-SR) methods are inadequate for ODIs, as their degradation models fail to account for the complex imaging pipeline involving fisheye capture and Equirectangular Projection (ERP), introducing severe aliasing and projection-specific distortions. To address these challenges, we propose D$^{2}$R$^{2}$OSR, a Degradation-Disentangled Representation framework for Real-world Omnidirectional image Super-Resolution. D$^{2}$R$^{2}$OSR explicitly models degradations arising from both fisheye imaging and ERP projection, guided by two key insights: (1) projection priors play a critical role in shaping real-world degradations, and (2) human perception in immersive environments is inherently viewpoint-centric. Accordingly, we introduce a Perspective Projection Representation (PPR) operating alongside the ERP branch to capture viewpoint-aware features, together with a Degradation-Specific Module (DSM) that jointly models ERP-induced geometric distortions and PPR-specific real-world degradations. Extensive experiments demonstrate that D$^{2}$R$^{2}$OSR achieves state-of-the-art performance and produces visually compelling, high-fidelity omnidirectional Real-SR results while maintaining favorable computational efficiency for low-resource deployment.",https://arxiv.org/abs/2606.29314v1,2026-06-28T10:21:26Z,arXiv - Enterprise AI Research,research,,2026-06-30T08:12:48+00:00
522ff4a586755e2f,Are There Manufacturer Differences in Hard-Drive Reliability?,"Based on the Backblaze hard disk drive (HDD) dataset, we analyze whether the four major HDD manufacturers represented in the dataset -- HGST, Seagate, Toshiba, Western Digital (WD) -- show differences in short- to medium-term HDD failure rates. Using two different duration regression models, we find -- holding constant drive age, capacity, form-factor, and drive temperature -- that Toshiba's failure rate is slightly above Seagate's. HGST HDD failure rates are the lowest, about 41% of Seagate's. WD HDD failure rates are significantly above HGST's, but still only about 52% of Seagate's. We also document the effects of age, capacity, temperature and drive location on failure rates.","Are There Manufacturer Differences in Hard-Drive Reliability?. Based on the Backblaze hard disk drive (HDD) dataset, we analyze whether the four major HDD manufacturers represented in the dataset -- HGST, Seagate, Toshiba, Western Digital (WD) -- show differences in short- to medium-term HDD failure rates. Using two different duration regression models, we find -- holding constant drive age, capacity, form-factor, and drive temperature -- that Toshiba's failure rate is slightly above Seagate's. HGST HDD failure rates are the lowest, about 41% of Seagate's. WD HDD failure rates are significantly above HGST's, but still only about 52% of Seagate's. We also document the effects of age, capacity, temperature and drive location on failure rates.",https://arxiv.org/abs/2606.29078v1,2026-06-27T20:32:03Z,arXiv - Enterprise AI Research,research,,2026-06-30T08:12:48+00:00
d92afebc6f36860e,Towards Improved Anomaly Detection for Cloud Cybersecurity via Graph Neural Networks,"Detecting security threats in an organization's cloud computing environment has become necessary due to the increased reliance on cloud infrastructure. Logging of all cloud computing events enables investigation into any incidents after they are detected. Automated detection of threats using the logs based on heuristics or anomaly detection could result in a high false positive rate due to its relatively static nature. In this article, we present an industrial case study of a self-supervised learning method using graph neural networks applied to AWS CloudTrail logs to surface suspicious events for analyst review. The model produces an anomaly score for each event and dynamically adapts to changes in the organization without requiring periodic retraining. Based on our experiments across five organizations, the proposed model produced substantially fewer alerts than a domain expert rule-based baseline in almost all cases, reducing alert volumes to approximately 1 per hour from thousands generated by traditional methods. We note that this evaluation covers only flagged events, and false negatives cannot be estimated from the current data; findings should therefore be interpreted as a practical deployment study offering insights into real-world constraints rather than a fully validated detection system. We discuss these limitations and the requirements for extending the approach to other cloud environments as future work.","Towards Improved Anomaly Detection for Cloud Cybersecurity via Graph Neural Networks. Detecting security threats in an organization's cloud computing environment has become necessary due to the increased reliance on cloud infrastructure. Logging of all cloud computing events enables investigation into any incidents after they are detected. Automated detection of threats using the logs based on heuristics or anomaly detection could result in a high false positive rate due to its relatively static nature. In this article, we present an industrial case study of a self-supervised learning method using graph neural networks applied to AWS CloudTrail logs to surface suspicious events for analyst review. The model produces an anomaly score for each event and dynamically adapts to changes in the organization without requiring periodic retraining. Based on our experiments across five organizations, the proposed model produced substantially fewer alerts than a domain expert rule-based baseline in almost all cases, reducing alert volumes to approximately 1 per hour from thousands generated by traditional methods. We note that this evaluation covers only flagged events, and false negatives cannot be estimated from the current data; findings should therefore be interpreted as a practical deployment study offering insights into real-world constraints rather than a fully validated detection system. We discuss these limitations and the requirements for extending the approach to other cloud environments as future work.",https://arxiv.org/abs/2606.28923v1,2026-06-27T13:56:56Z,arXiv - Enterprise AI Research,research,,2026-06-30T08:12:48+00:00
ac4e3ca72f453efc,Spherical-to-ERP Epipolar Rectification for Single-Axis Disparity in 360 Stereo,"Omnidirectional stereo images provide full-surround perception but violate the geometric assumptions of classical disparity estimation: in spherical or fisheye views, epipolar correspondences follow curved great-circle paths, producing two-dimensional displacements that cannot be treated as single-axis disparity before geometric rectification. In this work, we adopt a standard spherical-to-equirectangular (ERP) projection as a preprocessing step, which straightens epipolar curves and restores a one-dimensional disparity structure - horizontal for left-right rigs and vertical for top-bottom rigs. Building on our previously introduced RAFT + Epipolar-Aligned Channel Selection (EACS) framework, originally developed for rectilinear and ERP stereo, we examine whether the same modular pipeline remains accurate when the input originates from spherical stereo imagery. After ERP projection, dense optical flow from RAFT is reduced to disparity by retaining only the baseline-aligned flow component. Experiments on synthetic fisheye stereo datasets show that this spherical-to-ERP-to-RAFT+EACS pipeline produces accurate, smooth, and structurally consistent disparity maps at real-time speed. These findings confirm that established ERP preprocessing can be effectively combined with our earlier RAFT+EACS method to enable practical, interpretable, and efficient disparity estimation from spherical stereo, providing a straightforward pathway for extending conventional stereo pipelines to 360 imaging.","Spherical-to-ERP Epipolar Rectification for Single-Axis Disparity in 360 Stereo. Omnidirectional stereo images provide full-surround perception but violate the geometric assumptions of classical disparity estimation: in spherical or fisheye views, epipolar correspondences follow curved great-circle paths, producing two-dimensional displacements that cannot be treated as single-axis disparity before geometric rectification. In this work, we adopt a standard spherical-to-equirectangular (ERP) projection as a preprocessing step, which straightens epipolar curves and restores a one-dimensional disparity structure - horizontal for left-right rigs and vertical for top-bottom rigs. Building on our previously introduced RAFT + Epipolar-Aligned Channel Selection (EACS) framework, originally developed for rectilinear and ERP stereo, we examine whether the same modular pipeline remains accurate when the input originates from spherical stereo imagery. After ERP projection, dense optical flow from RAFT is reduced to disparity by retaining only the baseline-aligned flow component. Experiments on synthetic fisheye stereo datasets show that this spherical-to-ERP-to-RAFT+EACS pipeline produces accurate, smooth, and structurally consistent disparity maps at real-time speed. These findings confirm that established ERP preprocessing can be effectively combined with our earlier RAFT+EACS method to enable practical, interpretable, and efficient disparity estimation from spherical stereo, providing a straightforward pathway for extending conventional stereo pipelines to 360 imaging.",https://arxiv.org/abs/2606.24847v1,2026-06-23T17:27:07Z,arXiv - Enterprise AI Research,research,,2026-06-30T08:12:48+00:00
1589140dc29ecd1f,Non-asymptotic estimates of the minimal risk in statistical learning,"In this paper we prove some concentration inequalities for two types of error probabilities in the Empirical Risk Principle (ERP) in statistical learning, which provide a lower bound and an upper bound for the minimal risk (in terms of the minimal empirical risk) with non-asymptotic high confidence. The usual boundedness condition of the empirical risk function is relaxed to the Gaussian or exponential integrability condition. The confidence of the lower bound of the minimal risk is shown to be independent of the number of training parameters and the dimension of the input vectors, allowing one to detect the deficiency of a learning machine efficiently; and the confidence of the upper bound of the minimal risk is proved to be high provided that the sample size $n$ is much greater than the box dimension of the parameter set $Θ$ in the Orlicz metric $d_{ψ_1}$ associated with the risk functions. Our work is based on Talagrand's concentration inequalities (the sharp versions by Bousquet and Klein-Rio), transport-entropy inequalities and the recent progress in the theory of empirical processes and statistical learning.","Non-asymptotic estimates of the minimal risk in statistical learning. In this paper we prove some concentration inequalities for two types of error probabilities in the Empirical Risk Principle (ERP) in statistical learning, which provide a lower bound and an upper bound for the minimal risk (in terms of the minimal empirical risk) with non-asymptotic high confidence. The usual boundedness condition of the empirical risk function is relaxed to the Gaussian or exponential integrability condition. The confidence of the lower bound of the minimal risk is shown to be independent of the number of training parameters and the dimension of the input vectors, allowing one to detect the deficiency of a learning machine efficiently; and the confidence of the upper bound of the minimal risk is proved to be high provided that the sample size $n$ is much greater than the box dimension of the parameter set $Θ$ in the Orlicz metric $d_{ψ_1}$ associated with the risk functions. Our work is based on Talagrand's concentration inequalities (the sharp versions by Bousquet and Klein-Rio), transport-entropy inequalities and the recent progress in the theory of empirical processes and statistical learning.",https://arxiv.org/abs/2606.23295v1,2026-06-22T13:09:28Z,arXiv - Enterprise AI Research,research,,2026-06-30T08:12:48+00:00
115cca4decb7cf93,A Novel Approach to Temporal QoS Estimation via Extended Kalman Filter-Incorporated Latent Feature Analysis,"Predicting temporal Quality of Service (QoS) data is critical for optimizing network services and rationalizing resource allocation in cloud computing and service-oriented systems. Existing mainstream methods have achieved promising predictive performance. However, their purely data-driven manner limits their ability to capture non-stationary temporal patterns, thereby leading to accuracy degradation when temporal QoS data exhibits fluctuations. To tackle this limitation, we propose a novel Extended Kalman Filter-Enhanced Latent Feature Analysis (EKL) model to perform efficient and accurate temporal QoS prediction from the perspective of bidirectional model-data-driven learning. Its main idea is three-fold: a) designing a model-driven feature producer to obtain the temporal latent features to capture the intricate temporal pattern following the principle of an Extended Kalman Filter; b) building a data-driven feature producer based on the alternating least squares algorithm to identify time-invariant latent features describing intrinsic user-service characteristics; c) exploiting a density-oriented parallel strategy that achieves workload balancing by sorting users in accordance with their service invocation density, which effectively elevates computational efficiency. In addition, we provide a rigorous theoretical analysis to formally prove the convergence of the proposed EKL. Experimental evaluations conducted on real-world temporal QoS datasets reveal that our proposed EKL surpasses existing state-of-the-art models with respect to both computational efficiency and prediction accuracy for missing temporal QoS data.","A Novel Approach to Temporal QoS Estimation via Extended Kalman Filter-Incorporated Latent Feature Analysis. Predicting temporal Quality of Service (QoS) data is critical for optimizing network services and rationalizing resource allocation in cloud computing and service-oriented systems. Existing mainstream methods have achieved promising predictive performance. However, their purely data-driven manner limits their ability to capture non-stationary temporal patterns, thereby leading to accuracy degradation when temporal QoS data exhibits fluctuations. To tackle this limitation, we propose a novel Extended Kalman Filter-Enhanced Latent Feature Analysis (EKL) model to perform efficient and accurate temporal QoS prediction from the perspective of bidirectional model-data-driven learning. Its main idea is three-fold: a) designing a model-driven feature producer to obtain the temporal latent features to capture the intricate temporal pattern following the principle of an Extended Kalman Filter; b) building a data-driven feature producer based on the alternating least squares algorithm to identify time-invariant latent features describing intrinsic user-service characteristics; c) exploiting a density-oriented parallel strategy that achieves workload balancing by sorting users in accordance with their service invocation density, which effectively elevates computational efficiency. In addition, we provide a rigorous theoretical analysis to formally prove the convergence of the proposed EKL. Experimental evaluations conducted on real-world temporal QoS datasets reveal that our proposed EKL surpasses existing state-of-the-art models with respect to both computational efficiency and prediction accuracy for missing temporal QoS data.",https://arxiv.org/abs/2606.23010v1,2026-06-22T08:22:18Z,arXiv - Enterprise AI Research,research,,2026-06-30T08:12:48+00:00
4ebe3bab63de1eda,RLM-Cascade: Response-Level Speculative Decoding for Cost-Efficient LLM API Serving,"We present RLM-Cascade, a proxy-layer system that applies speculative decoding at the response level to reduce LLM API costs without requiring model architecture access or a shared vocabulary. A fast, inexpensive draft model generates a candidate response; a capable verify model accepts, enhances, or is bypassed entirely depending on a lightweight complexity router. On a real-world agentic coding workload (Claude Code), RLM-Cascade achieves a draft-use rate of 88.8% across 125 production requests, reducing API cost by 45.8% relative to a direct Opus baseline. Counter-intuitively, the proxy also reduces end-to-end latency: median response time is 2,026 ms versus 3,698 ms for Native Opus -- a 1.83X speedup at p50 -- because the SKIPPED path (DeepSeek only, no Opus call) dominates the workload distribution. Quality matches or exceeds the Opus baseline: 100% pass rate on a 20-task Code/Math/Instruct benchmark versus 95% for Native Opus. We further describe a rule-based complexity router that selects the SKIPPED path for simple agentic turns and a hybrid tool-call strategy that bypasses the speculative pipeline for schema-critical tool-selection turns. RLM-Cascade is deployed in production as an enterprise AI infrastructure component and published as open source with a live metrics dashboard and Prometheus endpoint.","RLM-Cascade: Response-Level Speculative Decoding for Cost-Efficient LLM API Serving. We present RLM-Cascade, a proxy-layer system that applies speculative decoding at the response level to reduce LLM API costs without requiring model architecture access or a shared vocabulary. A fast, inexpensive draft model generates a candidate response; a capable verify model accepts, enhances, or is bypassed entirely depending on a lightweight complexity router. On a real-world agentic coding workload (Claude Code), RLM-Cascade achieves a draft-use rate of 88.8% across 125 production requests, reducing API cost by 45.8% relative to a direct Opus baseline. Counter-intuitively, the proxy also reduces end-to-end latency: median response time is 2,026 ms versus 3,698 ms for Native Opus -- a 1.83X speedup at p50 -- because the SKIPPED path (DeepSeek only, no Opus call) dominates the workload distribution. Quality matches or exceeds the Opus baseline: 100% pass rate on a 20-task Code/Math/Instruct benchmark versus 95% for Native Opus. We further describe a rule-based complexity router that selects the SKIPPED path for simple agentic turns and a hybrid tool-call strategy that bypasses the speculative pipeline for schema-critical tool-selection turns. RLM-Cascade is deployed in production as an enterprise AI infrastructure component and published as open source with a live metrics dashboard and Prometheus endpoint.",https://arxiv.org/abs/2606.22840v1,2026-06-22T04:27:45Z,arXiv - Enterprise AI Research,research,,2026-06-30T08:12:48+00:00
5f9c0a734b71b06e,Detecting and Understanding Vulnerabilities in Fully Homomorphic Encryption Frameworks,"Fully homomorphic encryption (FHE) allows computations to be performed directly on encrypted data without decryption, offering strong privacy guarantees for sensitive data analysis. This capability is important for privacy-sensitive applications like secure cloud computing, finance, and healthcare. The complexity of FHE schemes, however, has hindered their practical adoption. To make FHE accessible to a broader range of developers, a new generation of specialized frameworks has emerged to translate high-level FHE programs into complex FHE operations, introducing a new programming paradigm. However, the inherent complexity of FHE frameworks makes them prone to incorrect implementation logic. Unlike mere crashes, logic bugs in these frameworks can silently corrupt encrypted computation, potentially leading to severe financial losses and security vulnerabilities in FHE-enhanced applications. In this work, we introduce HERTA, the first automated testing tool tailored for FHE frameworks. HERTA leverages metamorphic testing to uncover deep-seated implementation bugs and vulnerabilities across the multi-layered FHE software stack. To that end, we design a set of novel metamorphic relations (MRs) derived specifically from FHE semantics. These MRs stress the most challenging aspects of the pipeline, enabling automated correctness testing without the need for a manual ground truth. Our evaluation of HERTA on 3 leading industry frameworks discovered 21 previously unknown bugs, several of which have already been confirmed and fixed by developers. Furthermore, our hazard analysis reveals the critical security impact these bugs pose to the integrity and availability of FHE-based services.","Detecting and Understanding Vulnerabilities in Fully Homomorphic Encryption Frameworks. Fully homomorphic encryption (FHE) allows computations to be performed directly on encrypted data without decryption, offering strong privacy guarantees for sensitive data analysis. This capability is important for privacy-sensitive applications like secure cloud computing, finance, and healthcare. The complexity of FHE schemes, however, has hindered their practical adoption. To make FHE accessible to a broader range of developers, a new generation of specialized frameworks has emerged to translate high-level FHE programs into complex FHE operations, introducing a new programming paradigm. However, the inherent complexity of FHE frameworks makes them prone to incorrect implementation logic. Unlike mere crashes, logic bugs in these frameworks can silently corrupt encrypted computation, potentially leading to severe financial losses and security vulnerabilities in FHE-enhanced applications. In this work, we introduce HERTA, the first automated testing tool tailored for FHE frameworks. HERTA leverages metamorphic testing to uncover deep-seated implementation bugs and vulnerabilities across the multi-layered FHE software stack. To that end, we design a set of novel metamorphic relations (MRs) derived specifically from FHE semantics. These MRs stress the most challenging aspects of the pipeline, enabling automated correctness testing without the need for a manual ground truth. Our evaluation of HERTA on 3 leading industry frameworks discovered 21 previously unknown bugs, several of which have already been confirmed and fixed by developers. Furthermore, our hazard analysis reveals the critical security impact these bugs pose to the integrity and availability of FHE-based services.",https://arxiv.org/abs/2606.22519v1,2026-06-21T14:18:49Z,arXiv - Enterprise AI Research,research,,2026-06-30T08:12:48+00:00
