id,title,content,text,url,published,source,source_category,publisher,collected_at
90f23a3829364f84,Joint Service Placement and Resource Optimization in Hierarchical Edge-Cloud Networks,"Hierarchical edge-cloud computing-aided Internet of Things (IoT) networks offer low-latency and cost-efficient services to a growing number of data-intensive IoT devices. However, optimizing service placement, which involves determining the most suitable locations within a network to deploy various services, is critical to balancing workloads dynamically and ensuring efficient resource utilization. In this paper, we jointly optimize service placement, edge/cloud cooperation, task offloading, and bandwidth allocation to enhance processing efficiency and response times. The main objective is to minimize both the overall end-to-end latency and the system cost, including service deployment and operational costs. The formulated problem belongs to the class of non-convex mixed-integer nonlinear programming, where finding a feasible solution is already challenging. Towards a stable system, we first transform the original problem into a more tractable form and then decompose it into sub-problems which are solved at different timescales. Combining tools from relaxation and the successive convex approximation method, we develop iterative algorithms to solve these problems efficiently. With an appropriate penalty parameter, the proposed algorithms guarantee convergence to at least a local optimum. We produce extensive numerical results to demonstrate the superior performance of the proposed algorithms over benchmark schemes as well as emphasize the significance of the joint service placement and resource allocation in enhancing system performance and efficiency.","Joint Service Placement and Resource Optimization in Hierarchical Edge-Cloud Networks. Hierarchical edge-cloud computing-aided Internet of Things (IoT) networks offer low-latency and cost-efficient services to a growing number of data-intensive IoT devices. However, optimizing service placement, which involves determining the most suitable locations within a network to deploy various services, is critical to balancing workloads dynamically and ensuring efficient resource utilization. In this paper, we jointly optimize service placement, edge/cloud cooperation, task offloading, and bandwidth allocation to enhance processing efficiency and response times. The main objective is to minimize both the overall end-to-end latency and the system cost, including service deployment and operational costs. The formulated problem belongs to the class of non-convex mixed-integer nonlinear programming, where finding a feasible solution is already challenging. Towards a stable system, we first transform the original problem into a more tractable form and then decompose it into sub-problems which are solved at different timescales. Combining tools from relaxation and the successive convex approximation method, we develop iterative algorithms to solve these problems efficiently. With an appropriate penalty parameter, the proposed algorithms guarantee convergence to at least a local optimum. We produce extensive numerical results to demonstrate the superior performance of the proposed algorithms over benchmark schemes as well as emphasize the significance of the joint service placement and resource allocation in enhancing system performance and efficiency.",https://arxiv.org/abs/2605.24641v1,2026-05-23T16:15:05Z,arXiv - Enterprise AI Research,research,,2026-06-30T08:12:48+00:00
9ae327c17f65c6c8,Cloud Computing Review: A Decade of Research,"The popularity and rapid development of Cloud Computing in recent years has led to a vast number of publications capturing the accumulated knowledge in this field. Due to the interdisciplinary nature and significant relevance of cloud computing research, it has become increasingly challenging to comprehend the overall structure and progress of this field without employing analytical methods. While the evaluation of scientific research has a long tradition in many fields, we have identified a lack of comprehensive scientometric studies specifically focused on cloud computing. This study applies scientometric techniques to empirically examine cloud computing research evolution and current state from a macroscopic perspective. We employed the CiteSpace tool for visual analysis, exploring topics related to cloud computing by retrieving papers published between 2014 and 2023 from the Web of Science Core database. Our approach involved constructing collaboration networks among authors, institutions, and countries to pinpoint the most prolific contributors in each category. Through the analysis of core journal distributions via journal co-citations, document co-citation networks, and clustering analysis, we uncovered the underlying research topics and knowledge structure. The results of this study enhance our understanding of patterns, trends, and other critical factors, offering a foundation for guiding research activities, sharing knowledge, and fostering collaboration in the field of cloud computing research.","Cloud Computing Review: A Decade of Research. The popularity and rapid development of Cloud Computing in recent years has led to a vast number of publications capturing the accumulated knowledge in this field. Due to the interdisciplinary nature and significant relevance of cloud computing research, it has become increasingly challenging to comprehend the overall structure and progress of this field without employing analytical methods. While the evaluation of scientific research has a long tradition in many fields, we have identified a lack of comprehensive scientometric studies specifically focused on cloud computing. This study applies scientometric techniques to empirically examine cloud computing research evolution and current state from a macroscopic perspective. We employed the CiteSpace tool for visual analysis, exploring topics related to cloud computing by retrieving papers published between 2014 and 2023 from the Web of Science Core database. Our approach involved constructing collaboration networks among authors, institutions, and countries to pinpoint the most prolific contributors in each category. Through the analysis of core journal distributions via journal co-citations, document co-citation networks, and clustering analysis, we uncovered the underlying research topics and knowledge structure. The results of this study enhance our understanding of patterns, trends, and other critical factors, offering a foundation for guiding research activities, sharing knowledge, and fostering collaboration in the field of cloud computing research.",https://arxiv.org/abs/2605.24499v1,2026-05-23T10:14:50Z,arXiv - Enterprise AI Research,research,,2026-06-30T08:12:48+00:00
095dd7559772beda,Unlocking Apple's Private Cloud Compute: An Analysis of Privacy-Preserving Artificial Intelligence,"Many existing Artificial Intelligence (AI) solutions on mobile devices rely on an extensive collection of sensitive data, raising privacy concerns and often requiring storage for both context and model improvement. Apple's Private Cloud Compute (PCC) aims to address this by emphasizing mobile device integration and a privacy-first design. The central claim of PCC is that it does not store any user data and that user input and user accounts are unlinkable. While most of the PCC system specifications are public, compiled binaries add a layer of opaqueness. There are no reproducible builds, and there are no symbols within those binaries, creating potential discrepancies between the specification and what is shipped to the user. Additionally, the underlying models and interfaces for querying PCC are not openly accessible, limiting academic evaluation of model properties, such as accuracy. This poses a challenge in assessing whether a privacy-preserving approach like PCC is actually trustworthy while also providing high-quality answers. We are the first to reverse-engineer the PCC implementation on mobile devices to evaluate privacy aspects and to open its non-public interfaces on local devices to support custom PCC queries. We demonstrate this level of access beyond Apple's intended use cases by independently benchmarking the PCC model. We enable future research by making our PCC benchmarking framework publicly available.","Unlocking Apple's Private Cloud Compute: An Analysis of Privacy-Preserving Artificial Intelligence. Many existing Artificial Intelligence (AI) solutions on mobile devices rely on an extensive collection of sensitive data, raising privacy concerns and often requiring storage for both context and model improvement. Apple's Private Cloud Compute (PCC) aims to address this by emphasizing mobile device integration and a privacy-first design. The central claim of PCC is that it does not store any user data and that user input and user accounts are unlinkable. While most of the PCC system specifications are public, compiled binaries add a layer of opaqueness. There are no reproducible builds, and there are no symbols within those binaries, creating potential discrepancies between the specification and what is shipped to the user. Additionally, the underlying models and interfaces for querying PCC are not openly accessible, limiting academic evaluation of model properties, such as accuracy. This poses a challenge in assessing whether a privacy-preserving approach like PCC is actually trustworthy while also providing high-quality answers. We are the first to reverse-engineer the PCC implementation on mobile devices to evaluate privacy aspects and to open its non-public interfaces on local devices to support custom PCC queries. We demonstrate this level of access beyond Apple's intended use cases by independently benchmarking the PCC model. We enable future research by making our PCC benchmarking framework publicly available.",https://arxiv.org/abs/2605.24239v1,2026-05-22T21:31:17Z,arXiv - Enterprise AI Research,research,,2026-06-30T08:12:48+00:00
f73ad8a9d7e388ba,AI Assurance: A Comprehensive Testing Strategy for Enterprise AI Systems,"Enterprise AI systems, built on large language models, retrieval pipelines and autonomous agents, introduce a class of risks that traditional software quality assurance was never designed to address. These systems are probabilistic, context-sensitive and emergent: they cannot be verified to be correct in the classical sense, but only evaluated with increasing confidence. This paper presents a comprehensive assurance strategy for enterprise AI systems built around three key principles: first, that AI testing should focus on continuous risk reduction rather than strict correctness verification; second, that evaluation must be treated as a core engineering discipline alongside development; and third, that failures in AI assurance can lead to organizational impacts that are fundamentally different from those seen in traditional deterministic software systems. We introduce a structured AI Failure Taxonomy, propose a revised five-layer AI Assurance Pyramid and provide operational guidance on evaluation-driven development, RAG system testing, model lifecycle management and governance. The goal is to equip engineering leaders and practitioners with a strategy that is both philosophically grounded and operationally deployable.","AI Assurance: A Comprehensive Testing Strategy for Enterprise AI Systems. Enterprise AI systems, built on large language models, retrieval pipelines and autonomous agents, introduce a class of risks that traditional software quality assurance was never designed to address. These systems are probabilistic, context-sensitive and emergent: they cannot be verified to be correct in the classical sense, but only evaluated with increasing confidence. This paper presents a comprehensive assurance strategy for enterprise AI systems built around three key principles: first, that AI testing should focus on continuous risk reduction rather than strict correctness verification; second, that evaluation must be treated as a core engineering discipline alongside development; and third, that failures in AI assurance can lead to organizational impacts that are fundamentally different from those seen in traditional deterministic software systems. We introduce a structured AI Failure Taxonomy, propose a revised five-layer AI Assurance Pyramid and provide operational guidance on evaluation-driven development, RAG system testing, model lifecycle management and governance. The goal is to equip engineering leaders and practitioners with a strategy that is both philosophically grounded and operationally deployable.",https://arxiv.org/abs/2605.23459v1,2026-05-22T10:19:19Z,arXiv - Enterprise AI Research,research,,2026-06-30T08:12:48+00:00
d5a5b93f3ee7fc02,Contractual Skills: A GovernSpec Design Framework for Enterprise AI Agents,"Skills have become a practical packaging mechanism for agent instructions, workflows, scripts, and reference materials. In enterprise settings, however, a skill often needs to express more than task guidance: goals, input boundaries, permissions, human approval points, evidence requirements, output contracts, quality criteria, verification steps, and handoff rules. This paper proposes contractual skills, a GovernSpec-inspired design framework for organizing SKILL.md files as readable task contracts while preserving lightweight skill discovery and progressive loading. The framework clarifies the boundary between contractual skills, GovernSpec YAML contracts, Model Context Protocol (MCP) surfaces, tool adapters, runtime guardrails, tracing, and evaluation systems. We evaluate the framework with three offline empirical studies. The first text-generation experiment covers three enterprise skills, fifteen synthetic tasks, four instruction conditions, and eight generation models, producing 960 outputs and 1680 cross-judge score records. The second study is a public-skill A/B expansion: eight public skills are compared with contractual rewrites across forty-eight synthetic tasks, six generation models, two repeats, 1152 outputs, and two complete judge files. In this setting, contractual skills raise mean quality from 4.692 to 4.914 and reduce critical-error rate from 0.083 to 0.013. The third study is an offline tool-calling challenge with eight models and 192 simulated tool-call records. The results suggest that contractual skills are best understood as a governance layer that makes task intent, boundaries, and acceptance criteria explicit, not as a standalone safety mechanism.","Contractual Skills: A GovernSpec Design Framework for Enterprise AI Agents. Skills have become a practical packaging mechanism for agent instructions, workflows, scripts, and reference materials. In enterprise settings, however, a skill often needs to express more than task guidance: goals, input boundaries, permissions, human approval points, evidence requirements, output contracts, quality criteria, verification steps, and handoff rules. This paper proposes contractual skills, a GovernSpec-inspired design framework for organizing SKILL.md files as readable task contracts while preserving lightweight skill discovery and progressive loading. The framework clarifies the boundary between contractual skills, GovernSpec YAML contracts, Model Context Protocol (MCP) surfaces, tool adapters, runtime guardrails, tracing, and evaluation systems. We evaluate the framework with three offline empirical studies. The first text-generation experiment covers three enterprise skills, fifteen synthetic tasks, four instruction conditions, and eight generation models, producing 960 outputs and 1680 cross-judge score records. The second study is a public-skill A/B expansion: eight public skills are compared with contractual rewrites across forty-eight synthetic tasks, six generation models, two repeats, 1152 outputs, and two complete judge files. In this setting, contractual skills raise mean quality from 4.692 to 4.914 and reduce critical-error rate from 0.083 to 0.013. The third study is an offline tool-calling challenge with eight models and 192 simulated tool-call records. The results suggest that contractual skills are best understood as a governance layer that makes task intent, boundaries, and acceptance criteria explicit, not as a standalone safety mechanism.",https://arxiv.org/abs/2605.22634v2,2026-05-21T15:40:05Z,arXiv - Enterprise AI Research,research,,2026-06-30T08:12:48+00:00
7bdfdafe2d49dca5,Nf-PEAK: Process-Based Energy Attribution for Nextflow Workflows on Kubernetes Clusters,"Scientific workflows are pipelines of interdependent tasks. They are increasingly executed on shared Kubernetes clusters via workflow engines such as Nextflow. Their energy consumption matters for both cost and sustainability. It is necessary to examine and optimize workflow tasks individually, because they can be very heterogeneous. However, estimating task-level energy on clusters is difficult: Intel RAPL counters report only node-level energy, access to counters and host process information is typically restricted, and concurrent workloads introduce resource contention and measurement noise. We present Nf-PEAK, a containerized method to attribute CPU-package and DRAM energy to individual processes and Nextflow tasks. Nf-PEAK (i) identifies workflow pods, (ii) maps pods to host processes via cgroup metadata, (iii) samples RAPL and per-process performance counters, and (iv) applies a non-linear energy-credit model before aggregating results at task level. On a Kubernetes cluster, we evaluate three nf-core workflows under controlled co-located CPU load. Nf-PEAK reaches an average Mean Absolute Percentage Error of 6.6% in isolated runs and 10.9% when an unrelated workload saturates 8 of 32 hardware threads per node, and remains stable across 2, 3, 4, and 8 nodes. Compared to the state-of-the-art Kubernetes tool Kepler, Nf-PEAK yields lower error on average, particularly under co-located load.","Nf-PEAK: Process-Based Energy Attribution for Nextflow Workflows on Kubernetes Clusters. Scientific workflows are pipelines of interdependent tasks. They are increasingly executed on shared Kubernetes clusters via workflow engines such as Nextflow. Their energy consumption matters for both cost and sustainability. It is necessary to examine and optimize workflow tasks individually, because they can be very heterogeneous. However, estimating task-level energy on clusters is difficult: Intel RAPL counters report only node-level energy, access to counters and host process information is typically restricted, and concurrent workloads introduce resource contention and measurement noise. We present Nf-PEAK, a containerized method to attribute CPU-package and DRAM energy to individual processes and Nextflow tasks. Nf-PEAK (i) identifies workflow pods, (ii) maps pods to host processes via cgroup metadata, (iii) samples RAPL and per-process performance counters, and (iv) applies a non-linear energy-credit model before aggregating results at task level. On a Kubernetes cluster, we evaluate three nf-core workflows under controlled co-located CPU load. Nf-PEAK reaches an average Mean Absolute Percentage Error of 6.6% in isolated runs and 10.9% when an unrelated workload saturates 8 of 32 hardware threads per node, and remains stable across 2, 3, 4, and 8 nodes. Compared to the state-of-the-art Kubernetes tool Kepler, Nf-PEAK yields lower error on average, particularly under co-located load.",https://arxiv.org/abs/2605.22393v1,2026-05-21T12:26:47Z,arXiv - Enterprise AI Research,research,,2026-06-30T08:12:48+00:00
dd207b0600804ef0,Beyond Text-to-SQL: An Agentic LLM System for Governed Enterprise Analytics APIs,"Enterprise analytics aims to make organizational data accessible for decision-making, yet non-technical users still face barriers when using traditional business intelligence tools or Text-to-SQL systems. While recent Text-to-SQL approaches based on Large Language Models (LLMs) promise natural language access to structured data, they fall short in enterprise settings where analytics pipelines rely on governed APIs rather than raw databases. In practice, these APIs encapsulate complex business logic to ensure consistency, auditability, and security. However, delegating mathematical or aggregation logic to an LLM introduces reliability and compliance risks. To this end, we present Analytic Agent, an LLM-based agentic system that translates natural language intents into secure interactions with enterprise analytics APIs. Evaluated on 90 real enterprise use cases constructed by domain experts, it reliably interprets user goals, validates permissions, executes governed queries, and generates compliant visualizations through multi-step reasoning and policy-aware orchestration.","Beyond Text-to-SQL: An Agentic LLM System for Governed Enterprise Analytics APIs. Enterprise analytics aims to make organizational data accessible for decision-making, yet non-technical users still face barriers when using traditional business intelligence tools or Text-to-SQL systems. While recent Text-to-SQL approaches based on Large Language Models (LLMs) promise natural language access to structured data, they fall short in enterprise settings where analytics pipelines rely on governed APIs rather than raw databases. In practice, these APIs encapsulate complex business logic to ensure consistency, auditability, and security. However, delegating mathematical or aggregation logic to an LLM introduces reliability and compliance risks. To this end, we present Analytic Agent, an LLM-based agentic system that translates natural language intents into secure interactions with enterprise analytics APIs. Evaluated on 90 real enterprise use cases constructed by domain experts, it reliably interprets user goals, validates permissions, executes governed queries, and generates compliant visualizations through multi-step reasoning and policy-aware orchestration.",https://arxiv.org/abs/2605.21027v2,2026-05-20T11:00:56Z,arXiv - Enterprise AI Research,research,,2026-06-30T08:12:48+00:00
ce06f8fe52f7f802,Causely: A Causal Intelligence Layer for Enterprise AI A Benchmark Study on SRE and Reliability Workflows,"AI agents deployed into SRE workflows currently derive their understanding of environment state from raw observability telemetry at query time, paying a semantic-interpretation tax in tokens, latency, and inferential reliability. We propose Causely, a causal intelligence layer that maintains a structured representation of environment topology, attribute dependencies, and causal relationships that are anchroed to a ontological representation of the managed environment. Causely transforms raw telemetry into a live, queryable model providing the semantic and causal foundation AI agents require to diagnose, evaluate impact, and act safely in production. We evaluate this value proposition through a benchmark study conducted in a controlled setting with injected faults in a 24-microservice OpenTelemetry demo application. Our experiments compare four agent configurations (Claude Code, OpenAI Codex, HolmesGPT with Sonnet and Gemini backends). Experiments are run with and without access to Causely under two scenarios: an active incident and a healthy baseline. On the active-fault scenario, causal grounding reduces mean time-to-diagnosis by 63\%, mean token consumption by 60\%, and mean tool-call count by 78\%, compressing the investigation footprint by 4.8$\times$ and lowering direct API cost per run by 57\%; root-cause-diagnosis accuracy rises from 75\% to 100\%.","Causely: A Causal Intelligence Layer for Enterprise AI A Benchmark Study on SRE and Reliability Workflows. AI agents deployed into SRE workflows currently derive their understanding of environment state from raw observability telemetry at query time, paying a semantic-interpretation tax in tokens, latency, and inferential reliability. We propose Causely, a causal intelligence layer that maintains a structured representation of environment topology, attribute dependencies, and causal relationships that are anchroed to a ontological representation of the managed environment. Causely transforms raw telemetry into a live, queryable model providing the semantic and causal foundation AI agents require to diagnose, evaluate impact, and act safely in production. We evaluate this value proposition through a benchmark study conducted in a controlled setting with injected faults in a 24-microservice OpenTelemetry demo application. Our experiments compare four agent configurations (Claude Code, OpenAI Codex, HolmesGPT with Sonnet and Gemini backends). Experiments are run with and without access to Causely under two scenarios: an active incident and a healthy baseline. On the active-fault scenario, causal grounding reduces mean time-to-diagnosis by 63\%, mean token consumption by 60\%, and mean tool-call count by 78\%, compressing the investigation footprint by 4.8$\times$ and lowering direct API cost per run by 57\%; root-cause-diagnosis accuracy rises from 75\% to 100\%.",https://arxiv.org/abs/2605.18327v1,2026-05-18T12:45:02Z,arXiv - Enterprise AI Research,research,,2026-06-30T08:12:48+00:00
