id,title,content,text,url,published,source,source_category,publisher,collected_at
d0efeb53eda4c102,Stochastic Matching via Local Sparsification,"The classic online stochastic matching problem typically requires immediate and irrevocable matching decisions. However, in many modern decentralized systems such as real-time ride-hailing and distributed cloud computing, the primary bottleneck is often local communication bandwidth rather than the timing of the match itself. We formalize this challenge by introducing a two-stage local sparsification framework. In this setting, arriving requests must prune their realized compatibility sets to a strict budget of $k$ edges before a central coordinator optimizes the global matching. This creates a ""middle ground"" between local information constraints and global optimization utility. We propose a local selection strategy, parametrized by a fractional solution of the expected instance. Theoretically, we quantify the approximation ratio as a function of the solution's {\em spread}. We prove that under sufficient spread, our sparsifier globally preserves the expected size of the maximum matching. Empirically, we demonstrate the robustness of our approach using the New York City ride-hailing datasets and adversarial synthetic benchmarks. Our results show that near-optimal global matching is achievable even with highly constrained local budgets, significantly outperforming standard online baselines.","Stochastic Matching via Local Sparsification. The classic online stochastic matching problem typically requires immediate and irrevocable matching decisions. However, in many modern decentralized systems such as real-time ride-hailing and distributed cloud computing, the primary bottleneck is often local communication bandwidth rather than the timing of the match itself. We formalize this challenge by introducing a two-stage local sparsification framework. In this setting, arriving requests must prune their realized compatibility sets to a strict budget of $k$ edges before a central coordinator optimizes the global matching. This creates a ""middle ground"" between local information constraints and global optimization utility. We propose a local selection strategy, parametrized by a fractional solution of the expected instance. Theoretically, we quantify the approximation ratio as a function of the solution's {\em spread}. We prove that under sufficient spread, our sparsifier globally preserves the expected size of the maximum matching. Empirically, we demonstrate the robustness of our approach using the New York City ride-hailing datasets and adversarial synthetic benchmarks. Our results show that near-optimal global matching is achievable even with highly constrained local budgets, significantly outperforming standard online baselines.",https://arxiv.org/abs/2605.14195v1,2026-05-13T23:25:15Z,arXiv - Enterprise AI Research,research,,2026-06-30T08:12:48+00:00
cce42cede417823a,VectraYX-Nano: A 42M-Parameter Spanish Cybersecurity Language Model with Curriculum Learning and Native Tool Use,"We present VectraYX-Nano, a 41.95M-parameter decoder-only language model trained from scratch in Spanish for cybersecurity, with a Latin-American regional focus and native tool invocation via the Model Context Protocol (MCP). The model has four contributions. (i) Corpus: VectraYX-Sec-ES, a 170M-token Spanish corpus assembled by an eight-VM distributed pipeline at ~$25 USD of cloud compute and split into three curriculum phases (conversational 42M, cybersecurity 118M, offensive tooling 10M). (ii) Architecture: a 42M Transformer decoder with GQA, QK-Norm, RMSNorm, SwiGLU, RoPE and z-loss, paired with a domain-balanced 16,384-token byte-fallback BPE. (iii) Curriculum with replay across the three phases yields a monotonic loss descent (9.80 -> 3.17 -> 3.00 -> 2.16); after SFT (loss 1.74) the v2 bootstrap-ablation reference attains a conversational gate of 0.775 +/- 0.043 on B5 over N=4 seeds, and a controlled Phase-2 replay sweep over {0,5,10,25,50}% saturates B5 at >=25% replay. (iv) Two empirical findings, both N=4. A controlled bootstrap-corpus ablation across v2 (OpenSubs), v4 (mC4-ES), and v6 (60/25/15 OpenSubs/mC4/Wiki) exposes a loss-versus-register inversion: lower-perplexity bootstraps yield measurably worse conversational behavior (v2 > v4 > v6 on B5 at every paired seed). The B4 (tool-selection) floor of 0.000 is a corpus-density artifact, not a capacity gate: rebalancing the SFT mixture to tool-use ratio 1:21 yields VectraYX-Nano v7, the released headline configuration, reaching B4 = 0.230 +/- 0.052 at 42M while retaining B1 = 0.332 +/- 0.005 and B5 = 0.725 +/- 0.130; a LoRA replication on a 260M from-scratch mid-tier reaches 0.445 +/- 0.201. The released GGUF is 96 MB in F16, runs sub-second TTFT on commodity hardware under llama.cpp, and is, to our knowledge, the first published Spanish-native cybersecurity LLM with end-to-end MCP integration.","VectraYX-Nano: A 42M-Parameter Spanish Cybersecurity Language Model with Curriculum Learning and Native Tool Use. We present VectraYX-Nano, a 41.95M-parameter decoder-only language model trained from scratch in Spanish for cybersecurity, with a Latin-American regional focus and native tool invocation via the Model Context Protocol (MCP). The model has four contributions. (i) Corpus: VectraYX-Sec-ES, a 170M-token Spanish corpus assembled by an eight-VM distributed pipeline at ~$25 USD of cloud compute and split into three curriculum phases (conversational 42M, cybersecurity 118M, offensive tooling 10M). (ii) Architecture: a 42M Transformer decoder with GQA, QK-Norm, RMSNorm, SwiGLU, RoPE and z-loss, paired with a domain-balanced 16,384-token byte-fallback BPE. (iii) Curriculum with replay across the three phases yields a monotonic loss descent (9.80 -> 3.17 -> 3.00 -> 2.16); after SFT (loss 1.74) the v2 bootstrap-ablation reference attains a conversational gate of 0.775 +/- 0.043 on B5 over N=4 seeds, and a controlled Phase-2 replay sweep over {0,5,10,25,50}% saturates B5 at >=25% replay. (iv) Two empirical findings, both N=4. A controlled bootstrap-corpus ablation across v2 (OpenSubs), v4 (mC4-ES), and v6 (60/25/15 OpenSubs/mC4/Wiki) exposes a loss-versus-register inversion: lower-perplexity bootstraps yield measurably worse conversational behavior (v2 > v4 > v6 on B5 at every paired seed). The B4 (tool-selection) floor of 0.000 is a corpus-density artifact, not a capacity gate: rebalancing the SFT mixture to tool-use ratio 1:21 yields VectraYX-Nano v7, the released headline configuration, reaching B4 = 0.230 +/- 0.052 at 42M while retaining B1 = 0.332 +/- 0.005 and B5 = 0.725 +/- 0.130; a LoRA replication on a 260M from-scratch mid-tier reaches 0.445 +/- 0.201. The released GGUF is 96 MB in F16, runs sub-second TTFT on commodity hardware under llama.cpp, and is, to our knowledge, the first published Spanish-native cybersecurity LLM with end-to-end MCP integration.",https://arxiv.org/abs/2605.13989v3,2026-05-13T18:03:07Z,arXiv - Enterprise AI Research,research,,2026-06-30T08:12:48+00:00
1a657ee93fa659be,PanoWorld: Towards Spatial Supersensing in 360$^\circ$ Panorama World,"Multimodal large laboratory models (MLLMs) still struggle with spatial understanding under the dominant perspective-image paradigm, which inherits the narrow field of view of human-like perception. For navigation, robotic search, and 3D scene understanding, 360-degree panoramic sensing offers a form of supersensing by capturing the entire surrounding environment at once. However, existing MLLM pipelines typically decompose panoramas into multiple perspective views, leaving the spherical structure of equirectangular projection (ERP) largely implicit. In this paper, we study pano-native understanding, which requires an MLLM to reason over an ERP panorama as a continuous, observer-centered space. To this end, we first define the key abilities for pano-native understanding, including semantic anchoring, spherical localization, reference-frame transformation, and depth-aware 3D spatial reasoning. We then build a large-scale metadata construction pipeline that converts mixed-source ERP panoramas into geometry-aware, language-grounded, and depth-aware supervision, and instantiate these signals as capability-aligned instruction tuning data. On the model side, we introduce PanoWorld with Spherical Spatial Cross-Attention, which injects spherical geometry into the visual stream. We further construct PanoSpace-Bench, a diagnostic benchmark for evaluating ERP-native spatial reasoning. Experiments show that PanoWorld substantially outperforms both proprietary and open-source baselines on PanoSpace-Bench, H* Bench, and R2R-CE Val-Unseen benchmarks. These results demonstrate that robust panoramic reasoning requires dedicated pano-native supervision and geometry-aware model adaptation. All source code and proposed data will be publicly released.","PanoWorld: Towards Spatial Supersensing in 360$^\circ$ Panorama World. Multimodal large laboratory models (MLLMs) still struggle with spatial understanding under the dominant perspective-image paradigm, which inherits the narrow field of view of human-like perception. For navigation, robotic search, and 3D scene understanding, 360-degree panoramic sensing offers a form of supersensing by capturing the entire surrounding environment at once. However, existing MLLM pipelines typically decompose panoramas into multiple perspective views, leaving the spherical structure of equirectangular projection (ERP) largely implicit. In this paper, we study pano-native understanding, which requires an MLLM to reason over an ERP panorama as a continuous, observer-centered space. To this end, we first define the key abilities for pano-native understanding, including semantic anchoring, spherical localization, reference-frame transformation, and depth-aware 3D spatial reasoning. We then build a large-scale metadata construction pipeline that converts mixed-source ERP panoramas into geometry-aware, language-grounded, and depth-aware supervision, and instantiate these signals as capability-aligned instruction tuning data. On the model side, we introduce PanoWorld with Spherical Spatial Cross-Attention, which injects spherical geometry into the visual stream. We further construct PanoSpace-Bench, a diagnostic benchmark for evaluating ERP-native spatial reasoning. Experiments show that PanoWorld substantially outperforms both proprietary and open-source baselines on PanoSpace-Bench, H* Bench, and R2R-CE Val-Unseen benchmarks. These results demonstrate that robust panoramic reasoning requires dedicated pano-native supervision and geometry-aware model adaptation. All source code and proposed data will be publicly released.",https://arxiv.org/abs/2605.13169v2,2026-05-13T08:31:22Z,arXiv - Enterprise AI Research,research,,2026-06-30T08:12:48+00:00
b95c392be943826e,Indirect Computing Model with Indirect Formal Method,"This paper,from the perspective of a collaborative intelligent computing system formed by combining human-computer interface and collaborative computing programs, discusses the principles of optimized cloud computing technology supported by the combination of an indirect computing model and an indirect formal method. On the basis of systematically reviewing the influence of previous theoretical achievements Turing's computability theory,Kleene's formal theory of small strings,von Neumann's digital computer architecture and Turing's hypothesis on AI judgment on the mainstream general-purpose digital computer paradigm,the author focuses on introducing an indirect computing model and an indirect formal theory compatible with both large and small strings. Using Chinese information data as an example,the design concept of a collaborative intelligent computing system prototype is presented. The significance is that this achievement facilitates optimization of cloud computing from data centers to knowledge centers.","Indirect Computing Model with Indirect Formal Method. This paper,from the perspective of a collaborative intelligent computing system formed by combining human-computer interface and collaborative computing programs, discusses the principles of optimized cloud computing technology supported by the combination of an indirect computing model and an indirect formal method. On the basis of systematically reviewing the influence of previous theoretical achievements Turing's computability theory,Kleene's formal theory of small strings,von Neumann's digital computer architecture and Turing's hypothesis on AI judgment on the mainstream general-purpose digital computer paradigm,the author focuses on introducing an indirect computing model and an indirect formal theory compatible with both large and small strings. Using Chinese information data as an example,the design concept of a collaborative intelligent computing system prototype is presented. The significance is that this achievement facilitates optimization of cloud computing from data centers to knowledge centers.",https://arxiv.org/abs/2606.13690v1,2026-05-13T03:09:25Z,arXiv - Enterprise AI Research,research,,2026-06-30T08:12:48+00:00
6dbb996c51a11141,Multi-Pedestrian Safety Warning at Urban Intersections Use Case of Digital Twin,"Digital twins (DTs) for urban transportation systems have gained increasing attention; however, their systematic evaluation in safety-critical scenarios remains limited. This paper presents a multi-pedestrian safety warning system at urban intersections enabled by a tightly coupled physical-digital twin framework. Built upon the COSMOS city-scale wireless testbed in New York City, the proposed system integrates camera and ultra-wideband (UWB), edge-cloud computing, predictive trajectory modeling, and MQTT-based communication to deliver real-time safety alerts to vulnerable road users (VRUs). The system is evaluated through both field deployment and virtual reality (VR) experiments. Results demonstrate high warning generation accuracy, localization accuracy, efficient end-to-end latency under different model configurations, and significant reductions in user response time when warnings are issued. The proposed DT framework provides a scalable, modular, and generalizable solution for real-time multi-pedestrian safety enhancement at complex urban intersections.","Multi-Pedestrian Safety Warning at Urban Intersections Use Case of Digital Twin. Digital twins (DTs) for urban transportation systems have gained increasing attention; however, their systematic evaluation in safety-critical scenarios remains limited. This paper presents a multi-pedestrian safety warning system at urban intersections enabled by a tightly coupled physical-digital twin framework. Built upon the COSMOS city-scale wireless testbed in New York City, the proposed system integrates camera and ultra-wideband (UWB), edge-cloud computing, predictive trajectory modeling, and MQTT-based communication to deliver real-time safety alerts to vulnerable road users (VRUs). The system is evaluated through both field deployment and virtual reality (VR) experiments. Results demonstrate high warning generation accuracy, localization accuracy, efficient end-to-end latency under different model configurations, and significant reductions in user response time when warnings are issued. The proposed DT framework provides a scalable, modular, and generalizable solution for real-time multi-pedestrian safety enhancement at complex urban intersections.",https://arxiv.org/abs/2605.18823v1,2026-05-12T16:28:49Z,arXiv - Enterprise AI Research,research,,2026-06-30T08:12:48+00:00
45da7284c0fbc592,Digital Identity for Agentic Systems: Toward a Portable Authorization Standard for Autonomous Agents,"Enterprise AI is shifting from copilots to autonomous agents capable of executing workflows, negotiating outcomes, and making decisions with limited human oversight. As these systems extend across organizational boundaries, identity alone is insufficient: an agent's authority must also be explicit, constrained, auditable, revocable, and consistently interpretable by independent receivers. This paper analyzes representative enterprise use cases in insurance claims processing and supply chain integrity to surface structural gaps in existing identity and access models. It proposes a portable authorization model for autonomous agents based on issuer-authored authorization payloads, typed constraint algebra, decision-consistent evaluation semantics, delegation attenuation, governed semantic resolution, fail-closed processing, and pre-flight discovery. The model separates credential containers, authorization payload semantics, and enforcement engines, allowing profiles such as JWT/JWS, Verifiable Credentials, OAuth Rich Authorization Requests, or policy-engine bindings to preserve a common authorization meaning across trust boundaries.","Digital Identity for Agentic Systems: Toward a Portable Authorization Standard for Autonomous Agents. Enterprise AI is shifting from copilots to autonomous agents capable of executing workflows, negotiating outcomes, and making decisions with limited human oversight. As these systems extend across organizational boundaries, identity alone is insufficient: an agent's authority must also be explicit, constrained, auditable, revocable, and consistently interpretable by independent receivers. This paper analyzes representative enterprise use cases in insurance claims processing and supply chain integrity to surface structural gaps in existing identity and access models. It proposes a portable authorization model for autonomous agents based on issuer-authored authorization payloads, typed constraint algebra, decision-consistent evaluation semantics, delegation attenuation, governed semantic resolution, fail-closed processing, and pre-flight discovery. The model separates credential containers, authorization payload semantics, and enforcement engines, allowing profiles such as JWT/JWS, Verifiable Credentials, OAuth Rich Authorization Requests, or policy-engine bindings to preserve a common authorization meaning across trust boundaries.",https://arxiv.org/abs/2605.11487v1,2026-05-12T04:04:34Z,arXiv - Enterprise AI Research,research,,2026-06-30T08:12:48+00:00
2a173b382672c12b,AI in the Enterprise: How People Use M365 Copilot Chat,"M365 Copilot is used every week by millions of people across more than a million companies around the world as part of their workflows. Uniquely positioned in the AI landscape given its near-exclusive use for work purposes, M365 Copilot can offer a clear picture of how people use AI for work and where that usage may expand next. This paper characterizes that usage through direct classification of user interactions with M365 Copilot Chat. Based on an anonymized and privacy-preserving analysis of a sample of approximately 5.5 million sessions, we combine a learned classification of user intent with a classification of O*NET work activities done with M365 Copilot Chat. We find that M365 Copilot is emerging as an everyday assistant for knowledge work: writing dominates, but users also rely on it for information retrieval, analysis, decision making and strategizing, and evaluating and diagnosing programs and systems, among others. Information seeking tasks remain common, but time trends suggest a relative shift away from ``chat as search'' and toward content and communication-related work. Comparisons across occupational groupings and to work done in the labor market further show that usage is broad but uneven, where the relative share of work done with M365 Copilot Chat cuts across jobs in some cases and is occupation-specific in others. Areas of relative underrepresentation in the labor market suggest the next frontier for enterprise AI adoption.","AI in the Enterprise: How People Use M365 Copilot Chat. M365 Copilot is used every week by millions of people across more than a million companies around the world as part of their workflows. Uniquely positioned in the AI landscape given its near-exclusive use for work purposes, M365 Copilot can offer a clear picture of how people use AI for work and where that usage may expand next. This paper characterizes that usage through direct classification of user interactions with M365 Copilot Chat. Based on an anonymized and privacy-preserving analysis of a sample of approximately 5.5 million sessions, we combine a learned classification of user intent with a classification of O*NET work activities done with M365 Copilot Chat. We find that M365 Copilot is emerging as an everyday assistant for knowledge work: writing dominates, but users also rely on it for information retrieval, analysis, decision making and strategizing, and evaluating and diagnosing programs and systems, among others. Information seeking tasks remain common, but time trends suggest a relative shift away from ``chat as search'' and toward content and communication-related work. Comparisons across occupational groupings and to work done in the labor market further show that usage is broad but uneven, where the relative share of work done with M365 Copilot Chat cuts across jobs in some cases and is occupation-specific in others. Areas of relative underrepresentation in the labor market suggest the next frontier for enterprise AI adoption.",https://arxiv.org/abs/2605.23958v1,2026-05-11T23:13:26Z,arXiv - Enterprise AI Research,research,,2026-06-30T08:12:48+00:00
c10da3440ea64705,Agent-First Tool API: A Semantic Interface Paradigm for Enterprise AI Agent Systems,"As AI agents transition from research prototypes to enterprise production systems, the tool interfaces they consume remain rooted in human-oriented CRUD paradigms. This paper identifies five fundamental architectural mismatches between conventional APIs and autonomous agent requirements: exact-identifier dependence, rendering-oriented responses, single-shot interaction assumptions, user-equivalent authorization, and opaque error semantics. We propose the Agent-First Tool API paradigm, comprising three integrated mechanisms: (1) a Six-Verb Semantic Protocol that decomposes tool interactions into search, resolve, preview, execute, verify, and recover phases; (2) a Normalized Tool Contract (NTC) providing structured decision-support metadata including confidence scores, evidence chains, and suggested next actions; and (3) a dual-layer governance pipeline combining static capability policies with dynamic risk escalation. The paradigm is implemented and validated in a production multi-tenant SaaS platform serving 85 registered tools across 6 business domains. Comparative experiments on 50 real operational tasks demonstrate that Agent-First APIs achieve 88% end-to-end task success rate versus 64% for optimized CRUD baselines (+37.5%), while reducing required human interventions by 72.7% and improving autonomous error recovery by 5.8x. We establish that the paradigm is orthogonal and complementary to transport-layer standards such as MCP, operating as the semantic application layer above existing tool discovery and invocation protocols.","Agent-First Tool API: A Semantic Interface Paradigm for Enterprise AI Agent Systems. As AI agents transition from research prototypes to enterprise production systems, the tool interfaces they consume remain rooted in human-oriented CRUD paradigms. This paper identifies five fundamental architectural mismatches between conventional APIs and autonomous agent requirements: exact-identifier dependence, rendering-oriented responses, single-shot interaction assumptions, user-equivalent authorization, and opaque error semantics. We propose the Agent-First Tool API paradigm, comprising three integrated mechanisms: (1) a Six-Verb Semantic Protocol that decomposes tool interactions into search, resolve, preview, execute, verify, and recover phases; (2) a Normalized Tool Contract (NTC) providing structured decision-support metadata including confidence scores, evidence chains, and suggested next actions; and (3) a dual-layer governance pipeline combining static capability policies with dynamic risk escalation. The paradigm is implemented and validated in a production multi-tenant SaaS platform serving 85 registered tools across 6 business domains. Comparative experiments on 50 real operational tasks demonstrate that Agent-First APIs achieve 88% end-to-end task success rate versus 64% for optimized CRUD baselines (+37.5%), while reducing required human interventions by 72.7% and improving autonomous error recovery by 5.8x. We establish that the paradigm is orthogonal and complementary to transport-layer standards such as MCP, operating as the semantic application layer above existing tool discovery and invocation protocols.",https://arxiv.org/abs/2605.10555v1,2026-05-11T13:30:43Z,arXiv - Enterprise AI Research,research,,2026-06-30T08:12:48+00:00
